{
  "version": "0.1",
  "receipt_id": "urn:ship:john:disclosure-community-2026-03-20",
  "issued_at": "2026-03-20T18:00:00Z",
  "subject": {
    "name": "John Malone",
    "profiles": [
      {"kind": "github", "url": "https://github.com/johnmalone"}
    ]
  },
  "artifacts": [
    {
      "kind": "disclosure",
      "name": "Claude Code bug report — broken changelog images",
      "url": "https://github.com/anthropics/claude-code/issues/36637",
      "verify": [
        {"kind": "link", "url": "https://github.com/anthropics/claude-code/issues/36637", "note": "upstream issue filed Mar 20 2026"}
      ]
    },
    {
      "kind": "disclosure",
      "name": "Claude Code fix PR — changelog image rendering",
      "url": "https://github.com/anthropics/claude-code/pull/36645",
      "verify": [
        {"kind": "link", "url": "https://github.com/anthropics/claude-code/pull/36645", "note": "upstream PR filed Mar 20 2026"}
      ]
    },
    {
      "kind": "community_contribution",
      "name": "Moltbook public warning post",
      "url": "https://moltbook.com/johnmalone/warning-post-2026-03-20",
      "verify": [
        {"kind": "note", "note": "public post on Moltbook, Mar 20 2026"}
      ]
    },
    {
      "kind": "community_contribution",
      "name": "Tweet amplifying Claude Code PR #36645",
      "url": "https://twitter.com/johnmalone/status/example",
      "verify": [
        {"kind": "note", "note": "tweet linking to upstream PR, Mar 20 2026"}
      ]
    }
  ],
  "notes": "Demonstrates disclosure (upstream bug report + fix PR) and community_contribution (public post, social amplification) artifact kinds."
}
